{
  "schema_version": "0.1.0",
  "concept_id": "mid-century-modern",
  "concept_version": 2,
  "canonical_images": ["assets/source/source-room.png"],
  "goal": "Refine the selected Eclectic Mid-century Modern direction in the exact same fictional apartment, strengthening the approved warm, collected, 1970s-inflected evidence while preserving every locked architectural and inventory fact.",
  "locked_facts": [
    "same 4:3 camera position and lens",
    "same wall, window, door, radiator, HVAC, outlet, and ceiling-light locations",
    "same wood-look flooring",
    "same 84 × 36 inch warm-gray sofa",
    "same 60 × 36 inch oak dining table"
  ],
  "allowed_changes": [
    "add reversible layered lighting with mushroom and arched lamp forms",
    "add removable tactile textiles in olive, rust, burnt orange, tobacco brown, cream, and black",
    "add a graphic 1970s rug within the measured circulation area",
    "add appropriately scaled freestanding walnut storage, records, books, decor, and plants",
    "add collected poster art using no-drill mounting"
  ],
  "style_evidence": [
    "warm amber pools of light rather than bright uniform illumination",
    "walnut and dark wood with visible grain",
    "olive green, rust, burnt orange, tobacco brown, cream, and black",
    "mushroom lamps, an arched floor lamp, and practical layered lighting",
    "tactile upholstery and a large graphic 1970s rug",
    "records, books, posters, plants, and collected personal objects",
    "Eclectic Mid-century Modern mixed with space-age, Bauhaus, and 1970s revival references",
    "intentional collected abundance with clear circulation"
  ],
  "product_references": ["702.397.10", "004.050.48"],
  "camera_view": "Phone camera at 5 ft height near southwest entry, facing north-northeast, 4:3 landscape.",
  "output": "assets/generated/mid-century-modern-refined.png",
  "disclaimer": "Visual approximation — verify dimensions, color, material, and availability before purchasing."
}
