{
  "schema_version": "0.1.0",
  "concept_id": "japandi",
  "concept_version": 1,
  "canonical_images": ["assets/source/source-room.png"],
  "goal": "Explore a restrained Japandi alternative in the exact same fictional rental room.",
  "locked_facts": [
    "same 4:3 camera position and lens",
    "same wall, window, door, radiator, HVAC, outlet, and ceiling-light locations",
    "same wood-look flooring",
    "same 84 × 36 inch warm-gray sofa",
    "same 60 × 36 inch oak dining table"
  ],
  "allowed_changes": [
    "add pale-timber coffee table",
    "add paper or linen-shade floor lamp",
    "add removable flax and stone textiles",
    "add natural-material decor and plants",
    "add no-drill art"
  ],
  "style_evidence": [
    "pale timber",
    "textured neutrals",
    "low visual weight",
    "natural materials",
    "quiet negative space"
  ],
  "product_references": [],
  "camera_view": "Phone camera at 5 ft height near southwest entry, facing north-northeast, 4:3 landscape.",
  "output": "assets/generated/japandi.png",
  "disclaimer": "Visual approximation — verify dimensions, color, material, and availability before purchasing."
}
