{
  "schema_version": "0.1.0",
  "concept_id": "product-placement-test",
  "concept_version": 1,
  "canonical_images": ["assets/generated/mid-century-modern-refined.png"],
  "goal": "Place an approximate IKEA STOCKHOLM walnut veneer coffee table into the refined Mid-century Modern concept without changing anything else.",
  "locked_facts": [
    "same 4:3 camera position and lens",
    "same wall, window, door, radiator, HVAC, outlet, and ceiling-light locations",
    "same wood-look flooring",
    "same 84 × 36 inch warm-gray sofa",
    "same 60 × 36 inch oak dining table",
    "same refined textiles, floor lamp, art, decor, plants, lighting, and color balance"
  ],
  "allowed_changes": [
    "replace only the existing approximate coffee table with the IKEA STOCKHOLM coffee table appearance"
  ],
  "style_evidence": [
    "warm walnut veneer",
    "restrained 1960s reference",
    "calm neutral base"
  ],
  "product_references": [
    "IKEA STOCKHOLM coffee table, article 702.397.10, 70 7/8 × 23 1/4 inches"
  ],
  "camera_view": "Phone camera at 5 ft height near southwest entry, facing north-northeast, 4:3 landscape.",
  "output": "assets/generated/ikea-stockholm-placement.png",
  "disclaimer": "Visual approximation — verify dimensions, color, material, and availability before purchasing."
}
